id,task_type,difficulty,question,ref_answer,ann2_answer,agree
REG_001,regulatory_interpretation,easy,What is the minimum average operating profit an issuer must have over the preced,At least fifteen crore rupees,at least fifteen crore rupees,1
REG_002,regulatory_interpretation,easy,"Under SEBI ICDR Regulations, 2018, what percentage of the net offer must an issu",At least seventy five per cent.,At least seventy five per cent.,1
REG_003,regulatory_interpretation,easy,"Under SEBI ICDR Regulations, 2018, what is the minimum percentage of post-issue ",At least twenty per cent.,At least twenty per cent. of the post-issue capital.,1
REG_004,regulatory_interpretation,medium,"Under SEBI ICDR Regulations, 2018, what fraction of the anchor investor portion ",One-third,One-third of the anchor investor portion shall be reserved for domestic mutual funds.,1
REG_005,regulatory_interpretation,medium,"Under SEBI ICDR Regulations, 2018, for how long is the minimum promoters' contri",Three years from the date of allotment in the initial public offer,Three years from the date of allotment in the initial public offer.,1
REG_006,regulatory_interpretation,easy,What is the minimum application value for an entity to qualify as an anchor inve,At least ten crore rupees,Ten crore rupees.,1
REG_007,regulatory_interpretation,easy,"Under SEBI Takeover Regulations 2011, at what threshold of voting rights does an",Twenty-five per cent or more of the voting rights,Twenty-five per cent or more of the voting rights in such target company.,1
REG_008,regulatory_interpretation,medium,"Under SEBI Takeover Regulations 2011, an acquirer holding 25% or more in a targe",More than five per cent of the voting rights,5 per cent of the voting rights.,1
REG_009,regulatory_interpretation,medium,What is the minimum investment amount an employee or director of the Manager of ,Twenty five lakh rupees,Twenty five lakh rupees.,1
REG_010,regulatory_interpretation,medium,"Under SEBI AIF Regulations, 2012, what is the minimum continuing interest that t","Not less than five percent of the corpus or ten crore rupees, whichever is lower","not less than five percent of the corpus or ten crore rupees, whichever is lower.",1
REG_011,regulatory_interpretation,easy,"Under SEBI LODR Regulations 2015, what is the maximum permissible gap between tw",One hundred and twenty days,Not more than one hundred and twenty days.,1
REG_012,regulatory_interpretation,medium,"Under SEBI LODR Regulations 2015, a related party transaction is considered mate",Rupees one thousand crore or ten per cent of the annual consolidated turnover of the listed entity a,"Rupees one thousand crore or ten per cent of the annual consolidated turnover of the listed entity, ",1
REG_013,regulatory_interpretation,easy,"Under SEBI PIT Regulations 2015, within how many trading days must a company not",Within two trading days,Within two trading days of receipt of the disclosure.,1
REG_014,regulatory_interpretation,easy,"Under SEBI PIT Regulations 2015, what is the mandatory cooling-off period that m",At least sixty days,at least sixty days,1
REG_015,regulatory_interpretation,hard,"Under SEBI Settlement Proceedings Regulations 2018, what is the absolute latest ","One hundred and twenty calendar days from the expiry of the sixty-day period, or after the first hea","Sixty days from the expiry of the sixty-day window, or one hundred and twenty calendar days.",1
REG_016,regulatory_interpretation,medium,"Under SEBI Settlement Proceedings Regulations 2018, by what minimum percentage m",At least fifty percent,atleast fifty percent,1
REG_017,regulatory_interpretation,easy,"Under SEBI Mutual Funds Regulations, what is the maximum exit load that an open-",Three per cent of the applicable net asset value,The exit load of an open-ended mutual fund scheme shall not exceed three per cent of the applicable ,1
REG_018,regulatory_interpretation,easy,"Under SEBI Mutual Funds Regulations, what percentage of unit holders must pass a",Seventy-five per cent of the unit holders,Seventy-five per cent of the unit holders of a scheme must pass a resolution for its winding up.,1
REG_019,regulatory_interpretation,easy,"Under SEBI Stock Brokers Regulations 2026, what is the minimum net worth require",50 crore,50 crore.,1
REG_020,regulatory_interpretation,easy,"Under SEBI NCS Regulations 2021, what is the minimum notice period that an issue",At least twenty-one days,At least twenty-one days.,1
REG_021,regulatory_interpretation,easy,"Under SEBI REIT Regulations 2014, what is the minimum asset size required for a ",Five hundred crore rupees or more,A REIT shall have a minimum asset size of five hundred crore rupees or more.,1
REG_022,regulatory_interpretation,medium,"Under SEBI RTI & STA Regulations 2025, for how long must a registrar to an issue",A minimum period of eight years,Eight years,1
REG_023,regulatory_interpretation,medium,"Under SEBI Stock Exchanges and Clearing Corporations Regulations 2018, what is t",Five per cent of the paid-up equity share capital,Five per cent of the paid-up equity share capital.,1
REG_024,regulatory_interpretation,medium,"Under SEBI Credit Rating Agencies Regulations 1999, above what percentage shareh",More than ten per cent of the paid-up share capital,More than ten per cent of the paid-up share capital of that issuer.,1
REG_025,regulatory_interpretation,medium,"Under SEBI Depositories and Participants Regulations 2018, what is the threshold",More than five per cent of the paid-up equity share capital,More than five per cent of the paid-up equity share capital of such depository.,1
NUM_001,numerical_reasoning,medium,"Under SEBI ICDR Regulations 2018, what is the minimum total net tangible assets ",Nine crore rupees (three crore rupees per year × three years),3 crore rupees * 3 years = 9 crore rupees.,1
NUM_002,numerical_reasoning,medium,If the total portion available for allocation to qualified institutional buyers ,180 crore rupees (60% of 900 = 540 crore for anchor investors; one-third of 540 = 180 crore for dome,"60% of 900 crore rupees is 540 crore rupees, and one-third of 540 crore rupees is 180 crore rupees.",1
NUM_003,numerical_reasoning,medium,"Under SEBI Stock Brokers Regulations 2026, what is the maximum underwriting obli",100 crore rupees (5 crore net worth × 20 = 100 crore),20 * 5 crore = 100 crore.,1
NUM_004,numerical_reasoning,hard,"For a Category I AIF with a scheme corpus of exactly twenty crore rupees, what i","0.50 crore rupees (2.5% of 20 crore = 0.50 crore, which is lower than 5 crore)","2.5% of 20 crore rupees is 0.5 crore rupees, and 5 crore rupees is higher, so the minimum continuing",1
NUM_005,numerical_reasoning,hard,If a mutual fund scheme with net assets of 500 crore rupees borrows the maximum ,7.5 crore rupees (20% of 500 = 100 crore borrowed; 15% per annum for 6 months = 7.5% of 100 = 7.5 cr,"20% of 500 crore rupees is 100 crore rupees, and 15% of 100 crore rupees for 6 months is 7.5 crore r",1
NUM_006,numerical_reasoning,medium,For a listed entity whose audit committee has the minimum permissible number of ,"Two independent directors (two-thirds of minimum 3 members = 2, since two-thirds of 3 = 2)","Minimum members = 3, at least two-thirds independent, so minimum independent = 2/3 * 3 = 2. 
2",1
NUM_007,numerical_reasoning,hard,"Under SEBI Settlement Proceedings Regulations 2018, what is the total maximum nu",180 calendar days (60 days initial window + 120 days additional delayed period = 180 days total),"60 days (initial window) + 60 days (additional delayed period, since it's 60 calendar days from the ",1
NUM_008,numerical_reasoning,medium,"Under SEBI Takeover Regulations 2011, if an acquirer pays Rs. 250 per share in a",Rs. 50 per share (Rs. 300 highest price minus Rs. 250 offer price = Rs. 50 difference),The difference between the highest price paid during the twenty-six weeks period (Rs. 300) and the o,1
NUM_009,numerical_reasoning,hard,"Under SEBI ICDR Regulations 2018, if a warrant is allotted on 1 January 2024, wh",1 October 2025 (warrant tenure ends 18 months from allotment = 1 July 2025; exercise option within 3,"The warrant is valid for 18 months from 1 January 2024, so the last day is 30 June 2025, but the hol",1
NUM_010,numerical_reasoning,medium,"Under SEBI LODR Regulations 2015, if a listed entity holds its first board meeti",By 29 July of the same year (1 April + 120 days = 29 July),"To find the latest date for the second board meeting, 120 days must be added to the date of the firs",1
NUM_011,numerical_reasoning,easy,"Under SEBI AIF Regulations 2012, if a Category III AIF scheme has investable fun",50 crore rupees (10% of 500 crore = 50 crore),10% of 500 crore rupees = 0.1 * 500 crore rupees = 50 crore rupees.,1
NUM_012,numerical_reasoning,easy,"Under SEBI Mutual Funds Regulations, an AMC's board has 8 directors. What is the",Four independent directors (at least 50% of 8 = 4),"50% of 8 is 4. 
4",1
CON_001,contradiction_detection,medium,Do the two passages prescribe different lock-in periods for minimum promoters' c,Yes,Yes. Passage A prescribes a lock-in period of three years from the date of commencement of commercia,1
CON_002,contradiction_detection,medium,Do the two passages prescribe different lock-in durations for excess promoters' ,No,No. Both passages prescribe a lock-in period of six months from the date of allotment in the initial,1
CON_003,contradiction_detection,easy,Do the two passages prescribe different minimum continuing interest thresholds f,Yes,"Yes. Passage A prescribes a minimum continuing interest of ""not less than two and half percent of th",1
CON_004,contradiction_detection,easy,Do the two passages prescribe different maximum permissible gaps between consecu,No,No. The maximum time gap of one hundred and twenty days is specified for both the board meetings and,1
CON_005,contradiction_detection,hard,Do the two passages impose different shareholding thresholds triggering mandator,No,"Yes. The threshold for recognised stock exchanges is fifteen per cent for certain entities, whereas ",0
CON_006,contradiction_detection,medium,Do the two passages prescribe different disclosure timelines for companies versu,No,No. Both passages require notification to the stock exchange within two trading days of receipt of t,1
CON_007,contradiction_detection,hard,Do the two passages contradict each other regarding whether a second settlement ,No,No. Passage A states that an applicant who withdraws an application shall not be permitted to make a,1
CON_008,contradiction_detection,hard,Do the two passages prescribe different tests for disqualifying a custodian from,Yes,"Yes. Passage A focuses on voting rights and director representation, while Passage B considers direc",1
CON_009,contradiction_detection,medium,Do the two passages collectively indicate that the 50% monetary asset limit alwa,No,No. The limit of fifty per cent on monetary assets shall not be applicable in case the initial publi,1
CON_010,contradiction_detection,hard,Do the two passages impose the same advance notice period for different types of,No,"No. Passage A requires at least twenty-one days' notice for exercisable rights, while Passage B requ",1
CON_011,contradiction_detection,easy,Do the two passages prescribe different minimum corpus requirements for social i,Yes,"Yes. The social impact fund requires a corpus of at least five crore rupees, while the Alternative I",1
CON_012,contradiction_detection,medium,Do the two passages indicate that the same open offer trigger threshold applies ,No,No. The passages indicate that the open offer trigger threshold is twenty-five per cent for most tar,1
TMP_001,temporal_reasoning,medium,"Under SEBI ICDR Regulations, which definition of 'key managerial personnel' is c","The definition aligning with Companies Act 2013 sub-section (51) of section 2, effective from 31.01.",The definition of 'key managerial personnel' substituted by the SEBI (Issue of Capital and Disclosur,0
TMP_002,temporal_reasoning,easy,Which lock-in regime for minimum promoters' contribution applied before 13 Augus,"Three years from the date of commencement of commercial production or date of allotment, whichever i",Three years.,0
TMP_003,temporal_reasoning,hard,"Under SEBI LODR Regulations 2015, which provisions came into force on the date o",Sub-regulation (4) of regulation 23 and regulation 31A,The provisions of sub-regulation (4) of regulation 23 and regulation 31A.,1
TMP_004,temporal_reasoning,medium,Was the term 'Delisting Regulations' a defined term in the SEBI Takeover Regulat,"No — the definition of 'Delisting Regulations' was only inserted by the Third Amendment Regulations,","No, the term 'Delisting Regulations' was not a defined term at the time those regulations came into ",0
TMP_005,temporal_reasoning,easy,What was the name of the trading platform for emerging issuers under SEBI ICDR R,Institutional trading platform,Institutional trading platform,1
TMP_006,temporal_reasoning,medium,Which amendment to SEBI ICDR Regulations broadened the definition of 'associate',"The SEBI (ICDR) (Amendment) Regulations, 2025, effective from 08.03.2025","The SEBI (ICDR) (Amendment) Regulations, 2025.",1
TMP_007,temporal_reasoning,medium,"Before 7 September 2021, which SEBI regulations were cross-referenced in SEBI LO","The SEBI (Issue and Listing of Debt Securities) Regulations, 2008","SEBI (Issue and Listing of Debt Securities) Regulations, 2008.",1
TMP_008,temporal_reasoning,medium,"Under SEBI AIF Regulations 2012, how long could funds registered under the earli","Five years from the commencement of the SEBI (AIF) Regulations, 2012","For a period of five years from the commencement of the SEBI (AIF) Regulations, 2012.",1
TMP_009,temporal_reasoning,medium,"Under SEBI ICDR Regulations, where was the draft letter of offer filed before th",With the Board (SEBI),The draft letter of offer was required to be filed with the Board prior to 08.03.2025.,1
TMP_010,temporal_reasoning,hard,"After May 2021, which regulation number in which SEBI regulations defines the te","Regulation 2(ee) of the SEBI (Issue of Capital and Disclosure Requirements) Regulations, 2018","Regulation 2(ee) of the SEBI (Issue of Capital and Disclosure Requirements) Regulations, 2018.",1
TMP_011,temporal_reasoning,hard,"Before September 2018, what phrase was used in the SEBI Takeover Regulations 201",Is made,The phrase 'is made' was used in place of 'is required to be made under these regulations'.,1
TMP_012,temporal_reasoning,easy,The SEBI (Merchant Bankers) Regulations 1992 were enacted under which SEBI Act a,"The Securities and Exchange Board of India Act, 1992",Cannot be determined from context,0
TMP_013,temporal_reasoning,easy,Which set of SEBI regulations originally established the regulatory framework fo,"The SEBI (Mutual Funds) Regulations, 1996",The SEBI (Mutual Funds) Regulations originally notified in 1996.,1
TMP_014,temporal_reasoning,medium,What term was used in SEBI REIT Regulations 2014 before the 2016 amendment repla,Sponsor(s),sponsors,1
TMP_015,temporal_reasoning,easy,Which was enacted earlier — the SEBI (ICDR) Regulations 2009 or the SEBI (ICDR) ,"The SEBI (ICDR) Regulations, 2009 was enacted earlier",The SEBI (ICDR) Regulations 2009 was enacted earlier.,1
TMP_016,temporal_reasoning,medium,In which year was the concept of 'fugitive economic offender' first incorporated,"2018, effective from 16 November 2018",2018,1
TMP_017,temporal_reasoning,medium,"Under SEBI AIF Regulations, from which date could social impact funds start issu","25 July 2022, following the Third Amendment Regulations, 2022",25.07.2022,0
REG_067,regulatory_interpretation,easy,Within how many days must a stock exchange forward a completed registration appl,Thirty days,Not later than thirty days of receipt of the complete application.,1
REG_068,regulatory_interpretation,easy,Within how many days must an intermediary update material changes to the informa,Fifteen days,not later than fifteen days of the occurrence of such change.,1
REG_069,regulatory_interpretation,easy,What is the maximum time within which an intermediary must redress investor grie,Forty-five days of receipt of the grievance,forty-five days of receipt thereof,1
REG_070,regulatory_interpretation,easy,For how long is an applicant barred from making a fresh registration application,One year from the date of rejection,for a period of one year from the date of such rejection.,1
REG_071,regulatory_interpretation,medium,"Under SEBI (Intermediaries) Regulations 2008, within how many days must SEBI dis","Sixty days. If SEBI fails to communicate within sixty days, prior approval shall be deemed to have b","Within sixty days, and prior approval shall be deemed to have been granted if the decision is not co",1
REG_072,regulatory_interpretation,easy,What two things must a SEBI-registered intermediary prominently display at all i,"A photocopy of the certificate of registration, and the name and contact details of the compliance o",A photocopy of the certificate and the name and contact details of the compliance officer.,1
REG_073,regulatory_interpretation,medium,Under what three circumstances can a permanent certificate granted to an interme,"If the certificate is surrendered by the intermediary, or suspended, or cancelled in accordance with","The certificate can cease to be valid if it is surrendered by the intermediary, suspended, or cancel",1
REG_074,regulatory_interpretation,easy,What minimum investment amount must an accredited investor commit to a portfolio,Ten crore rupees,ten crore rupees.,1
REG_075,regulatory_interpretation,easy,What is the maximum permissible limit for any buy-back as a percentage of the ag,"Twenty-five per cent, based on standalone or consolidated financial statements, whichever sets out a","Twenty-five per cent or less of the aggregate of paid-up capital and free reserves, based on the sta",1
REG_076,regulatory_interpretation,easy,What is the maximum debt-to-capital ratio (secured plus unsecured debts to paid-,2:1,2:1,1
REG_077,regulatory_interpretation,easy,"Under SEBI (Buy-Back of Securities) Regulations 2018, how long must a company wa",One year from the date of expiry of the buyback period of the preceding offer.,One year reckoned from the date of expiry of buyback period of the preceding offer of buy-back.,1
REG_078,regulatory_interpretation,medium,From which three sources may a company fund a buy-back of its shares under SEBI ,"Free reserves, securities premium account, or proceeds of issue of shares or specified securities. A",A company may fund a buy-back from (a) its free reserves; (b) the securities premium account; or (c),1
REG_079,regulatory_interpretation,medium,A company defaulted on repayment of a term loan. The default was remedied. After,After three years have lapsed since the default ceased to subsist.,Three years after the default ceased to subsist.,1
REG_080,regulatory_interpretation,easy,"How does SEBI (Delisting of Equity Shares) Regulations, 2021 define 'compulsory ",Delisting of equity shares of a company by a recognised stock exchange under Chapter V of these regu,"""compulsory delisting"" means delisting of equity shares of a company by a recognised stock exchange ",1
REG_081,regulatory_interpretation,easy,What is the 'bidding period' as defined in SEBI (Delisting of Equity Shares) Reg,The period within which shareholders may tender their shares in acceptance of the offer for delistin,the period within which shareholders may tender their shares in acceptance of the offer for delistin,1
REG_082,regulatory_interpretation,easy,"When did the SEBI (Research Analysts) Regulations, 2014 come into force relative",On the ninetieth day from the date of publication in the Official Gazette.,On the ninetieth day from the date of their publication in the Official Gazette.,1
REG_083,regulatory_interpretation,easy,"Under SEBI (Research Analysts) Regulations 2014, who qualifies as an 'independen",A person whose only business activity is research analysis or preparation and/or publication of rese,A person whose only business activity is research analysis or preparation and/or publication of rese,1
REG_084,regulatory_interpretation,easy,From which financial year do the Reserve Bank of India (Small Finance Banks - Pr,Financial Year 2026-27,Financial Year (FY) 2026-27.,1
REG_085,regulatory_interpretation,easy,To which category of banks do the RBI (Small Finance Banks - Prudential Norms on,Small Finance Banks (SFBs),Small Finance Banks (SFBs),1
REG_086,regulatory_interpretation,easy,"Under the RBI SFB Dividend Directions 2026, what is the maximum aggregate divide",Not exceeding 75% of the PAT for the period for which the dividend is proposed.,75% of the PAT for the period for which the dividend is being proposed.,1
REG_087,regulatory_interpretation,medium,What four factors must the Board of Directors of a Small Finance Bank consider w,1. Divergence in NPA classification and provisioning as observed in RBI supervisory findings; 2. Aud,The Board of Directors shall consider: (1) divergence in asset classification and provisioning for N,1
REG_088,regulatory_interpretation,easy,"After declaring a dividend, within what time period must a Small Finance Bank su",Within a fortnight (two weeks) of the declaration of dividend.,Within a fortnight of declaration of dividend.,1
REG_089,regulatory_interpretation,easy,"Under the RBI SFB Dividend Directions 2026, is a bank eligible to declare divide",No. A bank that is under any explicit restrictions for declaration of dividends from the Reserve Ban,The bank shall not be under any explicit restrictions for declaration of dividends from the Reserve ,1
REG_090,regulatory_interpretation,medium,How is 'Adjusted Profit After Tax (PAT)' defined under the RBI SFB Dividend Dire,PAT of the financial year for which the dividend is proposed minus 50% of Net NPA as on March 31 of ,'Adjusted Profit After Tax (PAT)' means PAT of the financial year for which the dividend is proposed,1
REG_091,regulatory_interpretation,easy,"Under the RBI Master Direction on Unique Identifiers in Financial Markets 2026, ","January 01, 2027",Section B of the Directions on implementation of Unique Transaction Identifier (UTI) shall come into,1
REG_092,regulatory_interpretation,easy,"Under the RBI Master Direction on Unique Identifiers 2026, are entities without ",No. Entities without an LEI code are not eligible to undertake transactions in the financial markets,Entities without an LEI code shall not be eligible to undertake transactions in the financial market,1
REG_093,regulatory_interpretation,medium,"For non-derivative foreign exchange transactions, at what minimum transaction am",USD one million or equivalent thereof in other currencies.,USD one million or equivalent thereof in other currencies.,1
REG_094,regulatory_interpretation,easy,What is the minimum nominal amount for which Government of India dated securitie,"Minimum ₹10,000 (nominal), in multiples of ₹10,000 thereafter.","The minimum nominal amount is Rs. 10,000/- and they are issued in multiples of Rs. 10,000/- thereaft",1
NUM_067,numerical_reasoning,easy,"Using the formula for Adjusted PAT, calculate the Adjusted PAT for a Small Finan","₹13,750 crore. Calculation: ₹17,000 - (50% × ₹6,500) = ₹17,000 - ₹3,250 = ₹13,750 crore.","Adjusted PAT = ₹17,000 crore - 50% of ₹6,500 crore = ₹17,000 crore - ₹3,250 crore = ₹13,750 crore.",1
NUM_068,numerical_reasoning,medium,A Small Finance Bank has a Tier 1 Capital Ratio of 11.72% and an Adjusted PAT of,"₹5,500 crore. Calculation: Bank falls in Bucket B4 (above 11.5% and up to 13.5%), which allows 40% o","Maximum dividend allowable: 40% of ₹13,750 crore = ₹5,500 crore.",0
NUM_069,numerical_reasoning,medium,"Under RBI SFB Dividend Directions 2026, the Maximum Eligible Dividend is the low","₹5,500 crore. This is the lower of 75% of PAT (₹12,750 crore) and the Table 1 limit (₹5,500 crore).","75% of PAT is ₹12,750 crore, and the Table 1 limit is ₹5,500 crore, so the Maximum Eligible Dividend",1
NUM_070,numerical_reasoning,medium,"In Illustration 1 of the RBI SFB Dividend Directions 2026, the Maximum Eligible ","32.35%. Calculation: (₹5,500 ÷ ₹17,000) × 100 = 32.35%.",Maximum Eligible Dividend as percentage of PAT: 32.35%,0
NUM_071,numerical_reasoning,medium,"In Illustration 3, a Small Finance Bank has Maximum Eligible Dividend of ₹1,125 ","₹625 crore. Calculation: Maximum Eligible Dividend (₹1,125 crore) minus interim dividend already pai","Maximum permissible final dividend: (G) - (H) = 1,125 - 500 = 625 crore.",1
NUM_072,numerical_reasoning,easy,"A Small Finance Bank has a PAT of ₹40,500 crore and Net NPA of ₹5,000 crore. Wha","₹38,000 crore. Calculation: ₹40,500 - (50% × ₹5,000) = ₹40,500 - ₹2,500 = ₹38,000 crore.","Adjusted PAT = (A) - 50% of (B) = 40,500 - 50% of 5,000 = 40,500 - 2,500 = 38,000 crore.",1
NUM_073,numerical_reasoning,hard,"In Illustration 2, with Adjusted PAT of ₹38,000 crore and Bucket B5 (50% limit),","Maximum per Table 1: ₹19,000 crore (50% × ₹38,000). 75% of PAT: ₹30,375 crore (75% × ₹40,500). The M","Maximum dividend allowed per Table 1: 19,000 crore, 75% of PAT: 30,375 crore",1
NUM_074,numerical_reasoning,medium,"In the GoI dated securities auction announced on March 28, 2026, what is the max","₹33,000 crore. Calculation: Notified amount ₹29,000 crore + greenshoe of ₹2,000 crore per security ×","₹29,000 crore (notified amount) + ₹2,000 crore (additional subscription for the first security) + ₹2",1
NUM_075,numerical_reasoning,medium,"In the GoI dated securities auction announced on March 28, 2026, what is the tot","₹12,000 crore. It represents approximately 41.4% of the total notified amount (₹12,000 ÷ ₹29,000 × 1","Total notified amount for the 7.43% GS 2076 security: ₹12,000 crore. 
Total auction amount: ₹17,000 ",1
