id,task_type,difficulty,question,ref_answer,ann2_answer,agree
NUM_076,numerical_reasoning,easy,What is the total aggregate face value amount offered by all State Governments i,"₹57,408 crore","₹57,408 Crore",1
NUM_077,numerical_reasoning,easy,How much in total is Andhra Pradesh seeking to raise across all three of its sec,"₹3,900 crore. Calculation: ₹1,500 + ₹1,500 + ₹900 = ₹3,900 crore.","1500 + 1500 + 900 = 3900 
3900 crore",0
NUM_078,numerical_reasoning,easy,What is the total amount Karnataka is raising across all its five securities in ,"₹10,000 crore. Calculation: ₹2,000 × 5 securities = ₹10,000 crore.",Cannot be determined from context,0
NUM_079,numerical_reasoning,easy,What is the total amount of Government of India dated securities to be issued du,"₹8,20,000 crore","8,20,000 crore.",1
NUM_080,numerical_reasoning,easy,"In the GoI securities issuance calendar for H1 FY2026-27, what is the combined a","₹63,000 crore. Calculation: ₹29,000 (Week 1) + ₹34,000 (Week 2) = ₹63,000 crore.","₹29,000 crore + ₹34,000 crore = ₹63,000 crore",1
NUM_081,numerical_reasoning,easy,"In auction week 4 (April 20-24, 2026) of the GoI issuance calendar, what is the ","₹10,000 crore. Calculation: ₹5,000 crore (30-year regular) + ₹5,000 crore (30-year SGrB) = ₹10,000 c","₹5,000 crore + ₹5,000 crore = ₹10,000 crore",1
NUM_082,numerical_reasoning,easy,"As on March 13, 2026, what was India's total foreign exchange reserve in US doll","Total reserves: US$ 709,759 million. Weekly variation: a decrease of US$ 7,052 million.","Total Reserves: US$ 709,759 million, Variation over Week: US$ -7,052 million.",1
NUM_083,numerical_reasoning,easy,What was the year-on-year growth rate of aggregate deposits of Scheduled Commerc,11.9%,11.9%,1
NUM_084,numerical_reasoning,medium,"As of February 28, 2026, what was the year-on-year growth rate of M3 (broad mone",11.5%,"Year-on-Year growth rate = ((31,30,192 - 30,298,040) / 30,298,040) * 100, but the context passage di",0
NUM_085,numerical_reasoning,medium,"What was the value of India's gold reserves as on March 13, 2026 in US dollar te","Gold reserves as on March 13, 2026: US$ 130,681 million. Increase over the year: US$ 56,289 million.","Value of gold reserves as on March 13, 2026: US$ 130,681 million. Increase over the year: US$ 56,289",1
NUM_086,numerical_reasoning,hard,A company has paid-up capital and free reserves of ₹500 crore before a buy-back.,Maximum buy-back amount: ₹125 crore (25% × ₹500 crore). Maximum debt after buy-back: ₹750 crore assu,"Maximum buy-back amount: 25% of ₹500 crore = ₹125 crore. 
Maximum total debt after buy-back: 2 * (₹5",1
CON_028,contradiction_detection,easy,Do the two press releases state the same aggregate amount for the State Governme,No,"No. The aggregate amounts stated are ₹55,688 Crore and ₹57,408 Crore in the March 20, 2026, and Marc",1
CON_029,contradiction_detection,easy,Do Bucket B1 and Bucket B10 permit the same dividend payout as a percentage of A,No,"No. Bucket B1 allows a dividend payout of 0% of adjusted PAT, while Bucket B10 allows a dividend pay",1
CON_030,contradiction_detection,easy,Do Section A and Section B of the RBI Master Direction on Unique Identifiers in ,No,"No. Section A comes into force with immediate effect, while Section B comes into effect from January",1
CON_031,contradiction_detection,medium,Do the two passages prescribe the same maximum limit for all buy-back transactio,No,"No. Passage A sets the maximum limit at twenty-five per cent, while Passage B sets a lower limit of ",1
CON_032,contradiction_detection,medium,Are the two passages contradictory regarding RBI's authority over Small Finance ,No,"No. The passages are not contradictory as Passage A refers to ""explicit restrictions"" while Passage ",1
CON_033,contradiction_detection,medium,Do both passages describe intermediaries who hold permanent certificates under S,No,"No. Passage A describes intermediaries with permanent certificates, while Passage B refers to certif",1
CON_034,contradiction_detection,medium,"Does the GoI dated securities auction announced on March 28, 2026 use a uniform ",No,No. The auction will be conducted using multiple price method.,1
CON_035,contradiction_detection,easy,Do both passages state the same percentage of the notified amount reserved for n,Yes,Yes. Both passages state that five per cent of the notified amount will be reserved for non-competit,1
CON_036,contradiction_detection,medium,Do both passages identify different categories of profits ineligible for dividen,Yes,"Yes. Passage A refers to ""exceptional and / or extra-ordinary profits / income"" and Passage B refers",1
CON_037,contradiction_detection,medium,Do the two passages together suggest that a company can use buy-back as a mechan,No,No. A company shall not buy-back its shares or other specified securities so as to delist its shares,1
CON_038,contradiction_detection,medium,Does the repeal of the 2025 SFB Dividend Directions mean that all actions previo,No,"No. Notwithstanding such repeal, any action taken or purported to have been taken, or initiated unde",1
CON_039,contradiction_detection,medium,Do the original and revised press releases state the same borrowing amount for U,No,"No. The original press release states 1280 for the 18-year tenor, while the revised press release st",1
CON_040,contradiction_detection,hard,Does Passage B create an exception to the general rule in Passage A that every e,Yes,Yes. Passage B allows non-resident entities that are not legal entities in their country of incorpor,1
CON_041,contradiction_detection,hard,Do Chapters V and VI of the SEBI (Intermediaries) Regulations 2008 come into for,No,No. The provisions of Chapters V and VI come into force on the date of publication of these regulati,1
CON_042,contradiction_detection,easy,"Under the RBI SFB Dividend Directions 2026, do Bucket B2 and Bucket B3 allow the",No,"No. Bucket B2 allows a dividend of 20% of adjusted PAT, while Bucket B3 allows a dividend of 30% of ",1
CON_043,contradiction_detection,easy,Do the definitions of 'independent research analyst' and 'part-time research ana,No,"No. The definitions differ as an ""independent research analyst"" has only research analysis as their ",1
CON_044,contradiction_detection,medium,Do auction weeks 2 and 6 of the GoI issuance calendar for H1 FY2026-27 have the ,Yes,"Yes. Both Auction Week 2 and Auction Week 6 have the same structure, with ₹34,000 crore for a 10 Yea",1
CON_045,contradiction_detection,hard,Do the two passages together indicate that open-market buy-back through stock ex,No,No. Passage A states that buy-back from the open market through the stock exchange shall not be allo,1
TMP_028,temporal_reasoning,easy,Which was implemented first under the RBI Master Direction on Unique Identifiers,"The LEI framework (Section A) was implemented first, coming into force with immediate effect from Ma",The LEI framework was implemented first.,1
TMP_029,temporal_reasoning,medium,Among the five circulars superseded by the RBI Master Direction on Unique Identi,"CO.FMRD.MIOD.No.8/11.01.057/2025-26 dated February 18, 2026, which is the most recent of the five su","CO.FMRD.MIOD.No.8/11.01.057/2025-26 dated February 18, 2026.",1
TMP_030,temporal_reasoning,medium,"How many years elapsed between the issuance of the first LEI circular (June 01, ","Approximately 8 years and 10 months elapsed between June 1, 2017 and March 27, 2026.",9 years.,0
TMP_031,temporal_reasoning,medium,Describe the step-by-step reduction in the maximum open-market buy-back limit th,"15% (until March 31, 2023) → 10% (until March 31, 2024) → 5% (until March 31, 2025) → Complete prohi",Buy-back limit is reduced step-by-step: (i) to 15% of paid up capital and free reserves till March 3,1
TMP_032,temporal_reasoning,medium,Which set of RBI directions on Small Finance Bank dividend norms was in effect d,"The 2025 Directions (issued November 28, 2025) were in effect during FY 2025-26. The 2026 Directions",The 2025 Directions were in effect during FY 2025-26.,1
TMP_033,temporal_reasoning,medium,"In chronological order, what are the key dates in the lifecycle of the GoI dated","March 28 (announcement), March 30 – April 02 ('When Issued' trading period), April 02 (auction day, ","March 28, 2026, March 30, 2026, April 02, 2026, April 06, 2026.",1
TMP_034,temporal_reasoning,easy,For the State Government securities auction covered in this revised press releas,"March 21, 2026 (revised press release issued) → March 24, 2026 (auction conducted on E-Kuber) → Marc","The sequence of key events is: Press Release announcement on March 21, 2026, auction on March 24, 20",1
TMP_035,temporal_reasoning,medium,"Under SEBI (Intermediaries) Regulations 2008, an intermediary holding a permanen","Two years plus up to six months extension, for a maximum of two and a half years from the commenceme",Two years plus up to six months.,1
TMP_036,temporal_reasoning,medium,"The SEBI (Research Analysts) Regulations 2014 were published on September 1, 201","On the ninetieth day from September 1, 2014, which is approximately November 30, 2014.","They came into force on the ninetieth day from the date of their publication, approximately December",1
TMP_037,temporal_reasoning,medium,"In the GoI securities issuance calendar for H1 FY2026-27, which is the first auc","Auction Week 4 (April 20-24, 2026) is the first week to include Sovereign Green Bonds, with ₹5,000 c","Auction Week 4, ₹5,000 crore for 30 Year SGrB.",1
TMP_038,temporal_reasoning,easy,"The RBI SFB Dividend Directions 2026 were issued on March 10, 2026 but take effe","The 2025 Directions were issued before the 2026 Directions — on November 28, 2025, compared to March","The 2025 Directions (repealed circular dated November 28, 2025) were issued before the 2026 Directio",1
TMP_039,temporal_reasoning,hard,"A counterparty entered into an OTC derivative transaction on December 15, 2026. ","No. The UTI requirements (Section B) come into effect from January 01, 2027, and apply only to trans","No, Section B on UTI comes into effect from January 01, 2027.",1
TMP_040,temporal_reasoning,hard,An intermediary's time-limited certificate expires in 18 months from the commenc,The intermediary must apply at least three months before the earlier of: (a) expiry of the certifica,Three months prior to expiry of two years from the commencement of these regulations.,1
TMP_041,temporal_reasoning,medium,For how long was the Al-Nusrah Front listed on the ISIL (Da'esh) and Al-Qaida Sa,"Approximately 11 years and 9 months — from May 14, 2014 to February 27, 2026.",The Al-Nusrah Front was listed on the ISIL (Da'esh) and Al-Qaida Sanctions List for approximately 12,0
TMP_042,temporal_reasoning,easy,"Under the RBI GoI issuance calendar for H1 FY2026-27, if the third Monday of a m",On the fourth Monday of that month.,on the fourth Monday of the month.,1
TMP_043,temporal_reasoning,easy,"Under the RBI Master Direction on UTI 2026, if a market participant cannot obtai",Within five Mumbai business days from the date of the transaction.,Within five Mumbai business days from the date of the transaction.,1
TMP_044,temporal_reasoning,medium,"A company completed its buy-back (i.e., made the final payment to shareholders) ","June 15, 2026 — one year from the expiry date (June 15, 2025) of the buyback period of the preceding","June 15, 2026.",0
TMP_045,temporal_reasoning,hard,"In Illustration 3 of the RBI SFB Dividend Directions 2026, the bank paid interim","The constraint applies cumulatively across both payments. The Maximum Eligible Dividend (₹1,125 cror",The Maximum Eligible Dividend constraint applies cumulatively across both payments.,1
